{
  "schema_version": "1.0",
  "registry_version": "vehicle-model-registry-v1",
  "labels_version": "vehicle-labels-v1",
  "created_at": "2026-07-28T00:00:00Z",
  "target": {
    "os": "windows",
    "backend": "tensorrt",
    "engine_portability": "target_host_only"
  },
  "artifacts": [
    {
      "artifact_id": "vehicle-det-v1",
      "role": "detection",
      "delivery_status": "planned",
      "architecture": "YOLO11s Detect",
      "labels_version": "vehicle-labels-v1",
      "input": {
        "width": 960,
        "height": 960,
        "channels": 3,
        "layout": "NCHW",
        "color_order": "RGB",
        "dtype": "float32"
      },
      "output_names": [
        "vehicle_detections"
      ],
      "deployment": {
        "backend": "tensorrt",
        "precision": "fp16",
        "max_batch": 1,
        "target_os": "windows"
      },
      "files": {
        "onnx_path": "models/vehicle-det-v1.onnx",
        "engine_path": "engines/vehicle-det-v1.engine",
        "onnx_sha256": null,
        "engine_sha256": null
      },
      "provenance": {
        "dataset_version": null,
        "training_run_id": null,
        "code_commit": null,
        "model_card_path": null,
        "metrics_path": null
      }
    },
    {
      "artifact_id": "vehicle-attr-v1",
      "role": "attributes",
      "delivery_status": "planned",
      "architecture": "MobileNetV3-Large multitask",
      "labels_version": "vehicle-labels-v1",
      "input": {
        "width": 224,
        "height": 224,
        "channels": 3,
        "layout": "NCHW",
        "color_order": "RGB",
        "dtype": "float32"
      },
      "output_names": [
        "body_type",
        "color"
      ],
      "deployment": {
        "backend": "tensorrt",
        "precision": "fp16",
        "max_batch": 16,
        "target_os": "windows"
      },
      "files": {
        "onnx_path": "models/vehicle-attr-v1.onnx",
        "engine_path": "engines/vehicle-attr-v1.engine",
        "onnx_sha256": null,
        "engine_sha256": null
      },
      "provenance": {
        "dataset_version": null,
        "training_run_id": null,
        "code_commit": null,
        "model_card_path": null,
        "metrics_path": null
      }
    }
  ]
}
